{
  "schemaVersion": "pracmo-public-action@v2",
  "clientRequestId": "public-action-09-daily-learning-method-20260811-v1",
  "catalog": {
    "category": "study",
    "tags": [
      "学习方法",
      "备考",
      "记忆",
      "效率学习",
      "每日知识"
    ],
    "coverImage": {
      "objectKey": "material/100000/action-assets/staging/cover/20260811T134043Z-64c737372d-cover.jpg",
      "url": "https://wancai-beijing.oss-cn-beijing.aliyuncs.com/material/100000/action-assets/staging/cover/20260811T134043Z-64c737372d-cover.jpg",
      "alt": "学习卡片沿间隔与回忆路径逐步连接"
    }
  },
  "template": {
    "title": "今天学一个学习方法",
    "description": "工作日认识一种可操作的学习方法，理解它解决什么问题、适合什么任务，并完成一次十分钟的小实验。",
    "iconCode": "school",
    "colorCode": "blue",
    "scheduleType": "weekdays",
    "scheduleConfigJson": "{}",
    "timezone": "Asia/Shanghai",
    "deadlineLocalTime": "20:00",
    "gracePolicy": "none",
    "completionMode": "one_tap",
    "contentMode": "puki_generated",
    "generatedContentConfig": {
      "schemaVersion": 1,
      "type": "reading",
      "instruction": "生成一期“今天学一个学习方法”中文轻阅读。优先结合甲程目标、材料类型和当前状态，从主动回忆、间隔学习、交错练习、费曼解释、错题分析、例题变式、预习提问、刻意练习、检索线索中选择一个，避开近期主题。正文600—900字，结构为：方法解决的问题、核心机制、适合的任务、不适合或易误用的场景、一个具体案例、今天可完成的10分钟实践。不要包装成万能技巧，不编造提升百分比、论文结论或名人背书；证据有争议时使用审慎措辞。必须解释为什么，不能只有步骤。最后给一个用户可自行验证效果的观察指标。"
    }
  },
  "assets": [
    {
      "assetId": "cover",
      "role": "cover",
      "alt": "学习卡片沿间隔与回忆路径逐步连接",
      "objectKey": "material/100000/action-assets/staging/cover/20260811T134043Z-64c737372d-cover.jpg",
      "url": "https://wancai-beijing.oss-cn-beijing.aliyuncs.com/material/100000/action-assets/staging/cover/20260811T134043Z-64c737372d-cover.jpg",
      "contentType": "image/jpeg",
      "sizeBytes": 183147,
      "sha256": "608daa2cb68d58aae7f19295fe89f954df64ad5444d33353f36c82b820c55e8b"
    }
  ]
}
