{
  "schemaVersion": "pracmo-public-action@v2",
  "clientRequestId": "public-action-25-life-easter-egg-20260812-v1",
  "catalog": {
    "category": "creative",
    "tags": [
      "生活观察",
      "随手拍",
      "视觉日记",
      "3分钟",
      "创作素材"
    ],
    "coverImage": {
      "objectKey": "material/100004/action-assets/staging/cover/20260814T132153Z-991bcf8851-cover.jpg",
      "url": "https://wancai-beijing.oss-cn-beijing.aliyuncs.com/material/100004/action-assets/staging/cover/20260814T132153Z-991bcf8851-cover.jpg",
      "alt": "阳光经过玻璃在墙上投下彩虹，一片红叶落在光影中"
    }
  },
  "template": {
    "title": "今日一张生活彩蛋",
    "description": "每天发现并拍下一处容易错过的光影、颜色、排列或微小细节，再用一句话记录自己为什么停下来；一张照片和一句观察即算完成。",
    "iconCode": "camera",
    "colorCode": "gold",
    "scheduleType": "daily",
    "scheduleConfigJson": "{}",
    "timezone": "Asia/Shanghai",
    "deadlineLocalTime": "21:00",
    "gracePolicy": "none",
    "completionMode": "rich_media",
    "contentMode": "self_directed"
  },
  "assets": [
    {
      "assetId": "cover",
      "role": "cover",
      "alt": "阳光经过玻璃在墙上投下彩虹，一片红叶落在光影中",
      "objectKey": "material/100004/action-assets/staging/cover/20260814T132153Z-991bcf8851-cover.jpg",
      "url": "https://wancai-beijing.oss-cn-beijing.aliyuncs.com/material/100004/action-assets/staging/cover/20260814T132153Z-991bcf8851-cover.jpg",
      "contentType": "image/jpeg",
      "sizeBytes": 208289,
      "sha256": "64ab8bf2f4a3418e95a8fbc7726689befaacc129be86a5d68d1f71cde620a7c3"
    }
  ]
}
