{
  "schemaVersion": "pracmo-public-action@v2",
  "clientRequestId": "public-action-40-find-hidden-stance-20260812-v1",
  "catalog": {
    "category": "reading",
    "tags": [
      "媒介素养",
      "立场识别",
      "深度阅读",
      "信息辨别",
      "单选题"
    ],
    "coverImage": {
      "localPath": "assets/cover.jpg",
      "alt": "红色观察窗口揭示同一场景被不同纸张框选后的差异"
    }
  },
  "template": {
    "title": "这段话藏了什么立场",
    "description": "每天阅读一段原创短文，从选择性信息、情绪词和预设前提中判断文本立场，同时区分证据与无法确定的动机。",
    "iconCode": "book",
    "colorCode": "clay",
    "scheduleType": "weekdays",
    "scheduleConfigJson": "{}",
    "timezone": "Asia/Shanghai",
    "deadlineLocalTime": "20:30",
    "gracePolicy": "none",
    "completionMode": "one_tap",
    "contentMode": "puki_generated",
    "generatedContentConfig": {
      "schemaVersion": 1,
      "type": "quick_qa",
      "instruction": "结合甲程目标生成中文立场识别单选题。每题写一段180—280字原创短文，围绕低风险日常或公共议题，通过选择性信息、情绪词、模糊主体、预设前提或框架顺序体现一种可由文本支持的立场，避开近期主题。提供4个相近选项，唯一最佳答案必须由具体措辞或信息安排支持；干扰项体现过度推断、把事实当评价、猜测人格或忽略限定词。解释引用文本线索，并明确哪些作者动机仍无法确定。不要使用实时新闻、政治动员、群体刻板印象或受版权保护原文。输出前检查文本自包含、答案唯一且不是靠常识站队。",
      "quickQa": {
        "questionType": "single_choice"
      }
    }
  },
  "assets": [
    {
      "assetId": "cover",
      "role": "cover",
      "localPath": "assets/cover.jpg",
      "alt": "红色观察窗口揭示同一场景被不同纸张框选后的差异"
    }
  ]
}
