{
  "schemaVersion": "pracmo-public-action@v2",
  "clientRequestId": "public-action-25-life-easter-egg-20260812-v1",
  "catalog": {
    "category": "creative",
    "tags": [
      "生活观察",
      "随手拍",
      "视觉日记",
      "3分钟",
      "创作素材"
    ],
    "coverImage": {
      "localPath": "assets/cover.jpg",
      "alt": "阳光经过玻璃在墙上投下彩虹，一片红叶落在光影中"
    }
  },
  "template": {
    "title": "今日一张生活彩蛋",
    "description": "每天发现并拍下一处容易错过的光影、颜色、排列或微小细节，再用一句话记录自己为什么停下来；一张照片和一句观察即算完成。",
    "iconCode": "camera",
    "colorCode": "gold",
    "scheduleType": "daily",
    "scheduleConfigJson": "{}",
    "timezone": "Asia/Shanghai",
    "deadlineLocalTime": "21:00",
    "gracePolicy": "none",
    "completionMode": "rich_media",
    "contentMode": "self_directed"
  },
  "assets": [
    {
      "assetId": "cover",
      "role": "cover",
      "localPath": "assets/cover.jpg",
      "alt": "阳光经过玻璃在墙上投下彩虹，一片红叶落在光影中"
    }
  ]
}
