{
  "schemaVersion": "pracmo-public-action@v2",
  "clientRequestId": "public-action-31-daily-cognitive-bias-20260812-v1",
  "catalog": {
    "category": "mind",
    "tags": [
      "认知偏差",
      "思维训练",
      "决策",
      "心理常识",
      "深度阅读"
    ],
    "coverImage": {
      "objectKey": "material/100004/action-assets/staging/cover/20260814T132212Z-50eeb111bc-cover.jpg",
      "url": "https://wancai-beijing.oss-cn-beijing.aliyuncs.com/material/100004/action-assets/staging/cover/20260814T132212Z-50eeb111bc-cover.jpg",
      "alt": "同一器物经过两块镜片呈现不同形态"
    }
  },
  "template": {
    "title": "每日一个认知偏差拆解",
    "description": "每天用一个生活案例拆解一种认知偏差，理解直觉如何影响判断，并用一个自检问题把知识迁移到自己的决策中。",
    "iconCode": "meditate",
    "colorCode": "purple",
    "scheduleType": "daily",
    "scheduleConfigJson": "{}",
    "timezone": "Asia/Shanghai",
    "deadlineLocalTime": "20:30",
    "gracePolicy": "none",
    "completionMode": "one_tap",
    "contentMode": "puki_generated",
    "generatedContentConfig": {
      "schemaVersion": 1,
      "type": "reading",
      "instruction": "生成一期中文认知偏差深度轻阅读。优先结合甲程目标和当前状态，从决策、社交、学习、消费或信息判断中选择一个偏差，避开近期偏差、情境和案例。正文700—1000字，结构为：具体生活情境、直觉答案、偏差如何形成、一个反例或适用边界、一个可当天使用的自检问题。区分稳定概念、合理推断和个体差异；不编造研究、数据、来源或引语，不把偏差标签用于诊断用户或他人。内容不能只下定义，必须展示判断链条和纠偏取舍。输出前检查主题单一、案例自包含、边界清楚且与近期摘要不重复。"
    }
  },
  "assets": [
    {
      "assetId": "cover",
      "role": "cover",
      "alt": "同一器物经过两块镜片呈现不同形态",
      "objectKey": "material/100004/action-assets/staging/cover/20260814T132212Z-50eeb111bc-cover.jpg",
      "url": "https://wancai-beijing.oss-cn-beijing.aliyuncs.com/material/100004/action-assets/staging/cover/20260814T132212Z-50eeb111bc-cover.jpg",
      "contentType": "image/jpeg",
      "sizeBytes": 142773,
      "sha256": "7f372863144803b81730da8d62e4007eb29b2dee8bd4c84be309687264853acf"
    }
  ]
}
