{
  "schemaVersion": "pracmo-public-action@v2",
  "clientRequestId": "public-action-72-retirement-hobby-restart-20260819-v1",
  "catalog": {
    "category": "creative",
    "tags": [
      "退休生活",
      "兴趣重启",
      "小作品",
      "生活探索",
      "跟练计划"
    ],
    "coverImage": {
      "localPath": "assets/cover.jpg",
      "alt": "精神饱满的退休者在明亮兴趣工作台重新开始绘画与木作"
    }
  },
  "template": {
    "title": "退休兴趣重启计划",
    "description": "从回忆好奇心到完成15分钟体验、留下作品并找到分享伙伴，帮助退休用户以低成本、低压力方式重启个人兴趣。",
    "iconCode": "camera",
    "colorCode": "gold",
    "scheduleType": "weekly_quota",
    "scheduleConfigJson": "{\"quota\":3}",
    "timezone": "Asia/Shanghai",
    "deadlineLocalTime": "20:30",
    "gracePolicy": "none",
    "completionMode": "one_tap",
    "contentMode": "follow_along",
    "followPlan": {
      "afterCompletionPolicy": "continue_last_level",
      "levels": [
        {
          "title": "找回三条兴趣线索",
          "description": "从曾经喜欢、一直好奇和愿意再试中寻找方向。",
          "targetSessions": 4,
          "promotionCriterion": "能列出三条不同兴趣线索，并为每条写出吸引自己的具体部分，而非只写别人期待。",
          "estMinutes": 12,
          "contentBlocks": [
            {
              "blockType": "text",
              "textContent": "回想三类线索：过去做过且有一点喜欢的事、一直好奇但没开始的事、最近看到后愿意再试的事。每类至少写一项，并补一句“我喜欢的可能是……”。不按是否有用、能否赚钱或是否擅长筛选。若某段回忆不舒服，可以跳过。"
            }
          ]
        },
        {
          "title": "做成15分钟版本",
          "description": "把兴趣缩小到今天可开始的一小步。",
          "targetSessions": 5,
          "promotionCriterion": "能把一个兴趣改写成15分钟内、使用现有或低成本材料完成的尝试。",
          "estMinutes": 15,
          "contentBlocks": [
            {
              "blockType": "text",
              "textContent": "选择一条线索，把它缩小：不是“学摄影”，而是用手机拍三种光影；不是“学画画”，而是画一个杯子的轮廓。列出开始所需的1–3件材料和停止点。避免先购买整套器材、报名高价课程或安排高风险出行。"
            }
          ]
        },
        {
          "title": "完成不评价的小体验",
          "description": "先感受过程，不急着判断自己有没有天赋。",
          "targetSessions": 5,
          "promotionCriterion": "能完整尝试15分钟，并记录一个喜欢、一个不顺手和一个还想知道的地方。",
          "estMinutes": 15,
          "contentBlocks": [
            {
              "blockType": "text",
              "textContent": "按最小版本开始，定时15分钟。过程中只观察动作、声音、颜色、材料或注意力变化，不与专业作品比较。结束后写三句：我喜欢……；我不顺手……；下次我想知道……。常见错误是第一次就追求完整成品；允许只留下试样。"
            }
          ]
        },
        {
          "title": "留下一个小作品",
          "description": "用照片、文字或实物痕迹看见兴趣积累。",
          "targetSessions": 6,
          "promotionCriterion": "能为三次体验各保留一个可回看的小记录，并说出至少一处变化。",
          "estMinutes": 20,
          "contentBlocks": [
            {
              "blockType": "text",
              "textContent": "从一张照片、50字记录、一个草图、一段录音或小实物中选一种留下痕迹。标记本次做了什么和下次想调整什么，不公开也可以。只保存自己有权使用的内容，不复制受版权保护的完整作品，也不模仿在世创作者的独特风格。"
            }
          ]
        },
        {
          "title": "找到分享或同行的人",
          "description": "在自愿和舒服的边界内增加一次连接。",
          "targetSessions": 5,
          "promotionCriterion": "能向一位可信的人分享一次过程或约一次共同体验，并清楚表达自己想要的是陪伴、建议还是共同参与。",
          "estMinutes": 20,
          "contentBlocks": [
            {
              "blockType": "text",
              "textContent": "选择家人、老友、社区同好或可信线上群体中的一位，发送一张自有作品或一句近况，并说明希望对方怎样回应。也可以约一次低风险、公开场所的共同体验。保护住址、证件、支付和其他隐私；不接受让自己不舒服的评价或推销。"
            }
          ]
        },
        {
          "title": "设计每周兴趣时段",
          "description": "形成符合体力、预算和生活节奏的可持续安排。",
          "targetSessions": 4,
          "promotionCriterion": "能安排每周1–3个兴趣时段，列出低成本材料清单和取消条件，并在两周后根据真实体验调整。",
          "estMinutes": 20,
          "contentBlocks": [
            {
              "blockType": "text",
              "textContent": "回看前几次记录，选择最愿意继续的一项。安排每周1–3个15–45分钟时段，写清地点、材料和最小版本；同时设预算上限、体力边界和恶劣天气等取消条件。两周后只根据真实感受调整，不以专业水平、点赞或公开展示为目标。"
            }
          ]
        }
      ],
      "checkpoints": [
        {
          "levelIndex": 3,
          "title": "留下兴趣作品",
          "description": "能持续留下可回看的体验痕迹。",
          "isKey": false
        },
        {
          "levelIndex": 5,
          "title": "形成自己的兴趣节奏",
          "description": "有低成本、可调整、符合个人边界的每周安排。",
          "isKey": true
        }
      ]
    }
  },
  "assets": [
    {
      "assetId": "cover",
      "role": "cover",
      "localPath": "assets/cover.jpg",
      "alt": "精神饱满的退休者在明亮兴趣工作台重新开始绘画与木作"
    }
  ]
}
