{
  "schemaVersion": "pracmo-public-action@v2",
  "clientRequestId": "public-action-27-send-delayed-message-20260812-v1",
  "catalog": {
    "category": "work",
    "tags": [
      "沟通闭环",
      "拖延清理",
      "职场沟通",
      "5分钟",
      "行动力"
    ],
    "coverImage": {
      "objectKey": "material/100000/action-assets/staging/cover/20260811T160912Z-8b98e1683d-cover.jpg",
      "url": "https://wancai-beijing.oss-cn-beijing.aliyuncs.com/material/100000/action-assets/staging/cover/20260811T160912Z-8b98e1683d-cover.jpg",
      "alt": "手将纸飞机送向桌面另一侧，象征发出拖延已久的消息"
    }
  },
  "template": {
    "title": "发出那条拖延的消息",
    "description": "选一条该确认、请求、拒绝或跟进的消息，先核对对象、事实和语气，再在五分钟内发送；不鼓励情绪激动时冲动沟通。",
    "iconCode": "chat",
    "colorCode": "blue",
    "scheduleType": "weekdays",
    "scheduleConfigJson": "{}",
    "timezone": "Asia/Shanghai",
    "deadlineLocalTime": "17:30",
    "gracePolicy": "none",
    "completionMode": "one_tap",
    "contentMode": "self_directed"
  },
  "assets": [
    {
      "assetId": "cover",
      "role": "cover",
      "alt": "手将纸飞机送向桌面另一侧，象征发出拖延已久的消息",
      "objectKey": "material/100000/action-assets/staging/cover/20260811T160912Z-8b98e1683d-cover.jpg",
      "url": "https://wancai-beijing.oss-cn-beijing.aliyuncs.com/material/100000/action-assets/staging/cover/20260811T160912Z-8b98e1683d-cover.jpg",
      "contentType": "image/jpeg",
      "sizeBytes": 139504,
      "sha256": "6ceb9c40bc814b52057e302d3d059ee8e425ef43108b2ca8dc5a493dd7dd3ac4"
    }
  ]
}
