{
  "schemaVersion": "pracmo-public-action@v2",
  "clientRequestId": "public-action-37-spot-false-logic-20260812-v1",
  "catalog": {
    "category": "study",
    "tags": [
      "逻辑训练",
      "论证分析",
      "每日一题",
      "批判思考",
      "单选题"
    ],
    "coverImage": {
      "objectKey": "material/100000/action-assets/staging/cover/20260811T161138Z-53b8ec8356-cover.jpg",
      "url": "https://wancai-beijing.oss-cn-beijing.aliyuncs.com/material/100000/action-assets/staging/cover/20260811T161138Z-53b8ec8356-cover.jpg",
      "alt": "一条推理链中断裂的红色环节被光线照亮"
    }
  },
  "template": {
    "title": "识破一句伪逻辑",
    "description": "每天拆解一个原创短论证，识别错误因果、以偏概全或概念偷换，并通过文本证据说清漏洞在哪里。",
    "iconCode": "exam",
    "colorCode": "blue",
    "scheduleType": "weekdays",
    "scheduleConfigJson": "{}",
    "timezone": "Asia/Shanghai",
    "deadlineLocalTime": "20:00",
    "gracePolicy": "none",
    "completionMode": "one_tap",
    "contentMode": "puki_generated",
    "generatedContentConfig": {
      "schemaVersion": 1,
      "type": "quick_qa",
      "instruction": "结合甲程目标生成逻辑辨析单选题。每题提供一个原创、具体、自包含的短论证，轮换错误因果、以偏概全、诉诸情绪、错误二分、概念偷换和样本偏差，避开近期结构与情境。设置4个长度和语法相近的选项，只有一个最准确地指出论证缺口；干扰项应是常见误判，不能靠措辞明显排除。解释须引用论证中的关键前提或跳步，并给一个能检验该漏洞的反例或补充问题。不要把“我不同意结论”当作逻辑错误，不涉及实时政治新闻或群体刻板印象。输出前检查答案唯一、术语准确且难度适配用户状态。",
      "quickQa": {
        "questionType": "single_choice"
      }
    }
  },
  "assets": [
    {
      "assetId": "cover",
      "role": "cover",
      "alt": "一条推理链中断裂的红色环节被光线照亮",
      "objectKey": "material/100000/action-assets/staging/cover/20260811T161138Z-53b8ec8356-cover.jpg",
      "url": "https://wancai-beijing.oss-cn-beijing.aliyuncs.com/material/100000/action-assets/staging/cover/20260811T161138Z-53b8ec8356-cover.jpg",
      "contentType": "image/jpeg",
      "sizeBytes": 456819,
      "sha256": "84ace216b0029026ebc4ae7543c3bc3400b7dd4b335bf6137ca29b6d759d81fd"
    }
  ]
}
