{
  "schemaVersion": "pracmo-public-action@v2",
  "clientRequestId": "public-action-62-pocket-money-choice-20260819-v1",
  "catalog": {
    "category": "habit",
    "tags": [
      "零花钱",
      "消费选择",
      "金融素养",
      "情境题",
      "青少年"
    ],
    "coverImage": {
      "objectKey": "material/100004/action-assets/staging/cover/20260819T065841Z-8bf73fa231-cover.jpg",
      "url": "https://wancai-beijing.oss-cn-beijing.aliyuncs.com/material/100004/action-assets/staging/cover/20260819T065841Z-8bf73fa231-cover.jpg",
      "alt": "青少年在预算代币、储蓄罐和多个可逆选项间做选择"
    }
  },
  "template": {
    "title": "零花钱选择实验",
    "description": "用虚构小额预算练习比较、延迟决定和支付安全，不提供真实投资建议。",
    "iconCode": "habit",
    "colorCode": "gold",
    "scheduleType": "weekly_quota",
    "scheduleConfigJson": "{\"quota\":3}",
    "timezone": "Asia/Shanghai",
    "deadlineLocalTime": "20:30",
    "gracePolicy": "none",
    "completionMode": "one_tap",
    "contentMode": "puki_generated",
    "generatedContentConfig": {
      "schemaVersion": 1,
      "type": "quick_qa",
      "instruction": "生成“零花钱选择实验”情境单选题，训练计划、比较、延迟决定、识别隐藏条件和数字支付安全。每题用虚构小额预算与年龄适配场景，轮换零食、游戏道具、兴趣用品、同伴活动、订阅、促销、储蓄目标、二手交易和家庭共同支出。使用最近最多20条记录，避免重复“场景+决策冲突+最佳策略”；同一主题再次出现时更换预算约束、时间跨度和同伴影响。提供4个真实可选的选项，最佳项体现目标匹配、总成本、可逆性和安全；解释比较取舍，不把节省永远设为唯一答案。不得引导真实投资、借贷、博彩、绕过家长授权或提供具体金融产品建议。涉及支付时强调与监护人确认、保护验证码和核对收款对象。",
      "quickQa": {
        "questionType": "single_choice"
      }
    }
  },
  "assets": [
    {
      "assetId": "cover",
      "role": "cover",
      "alt": "青少年在预算代币、储蓄罐和多个可逆选项间做选择",
      "objectKey": "material/100004/action-assets/staging/cover/20260819T065841Z-8bf73fa231-cover.jpg",
      "url": "https://wancai-beijing.oss-cn-beijing.aliyuncs.com/material/100004/action-assets/staging/cover/20260819T065841Z-8bf73fa231-cover.jpg",
      "contentType": "image/jpeg",
      "sizeBytes": 243310,
      "sha256": "ed12ae7a8c45a7ddc361b539c8c38fa064a1f19697ee296349ba5cc95c98eb49"
    }
  ]
}
