{
  "schemaVersion": "pracmo-public-action@v2",
  "clientRequestId": "public-action-33-everyday-object-design-history-20260812-v1",
  "catalog": {
    "category": "creative",
    "tags": [
      "设计史",
      "日用品",
      "产品观察",
      "创意灵感",
      "轻阅读"
    ],
    "coverImage": {
      "localPath": "assets/cover.jpg",
      "alt": "四把不同时代的椅子呈现日用品设计演变"
    }
  },
  "template": {
    "title": "一件日用品的设计史",
    "description": "从一件普通日用品的演变中观察问题、材料、功能和形态如何互相影响，把熟悉物品重新看成一连串设计取舍。",
    "iconCode": "design",
    "colorCode": "clay",
    "scheduleType": "daily",
    "scheduleConfigJson": "{}",
    "timezone": "Asia/Shanghai",
    "deadlineLocalTime": "20:30",
    "gracePolicy": "none",
    "completionMode": "one_tap",
    "contentMode": "puki_generated",
    "generatedContentConfig": {
      "schemaVersion": 1,
      "type": "reading",
      "instruction": "生成一期中文日用品设计史轻阅读。结合甲程目标，从拉链、雨伞、椅子、铅笔、保温杯、剪刀、订书机等普通物品中选一个，避开近期物品与设计问题。正文600—900字，依次说明：最初要解决的问题、一次关键演变、材料与形态的取舍、一个失败或受限方向、今天可观察的细节。只采用稳定且可合理确认的历史信息；不确定的年代、人物或动机应省略或明确为推测，不编造首创者和品牌故事。不要只罗列年份，重点解释设计为何改变。输出前检查没学过设计的用户也能理解并完成观察任务。"
    }
  },
  "assets": [
    {
      "assetId": "cover",
      "role": "cover",
      "localPath": "assets/cover.jpg",
      "alt": "四把不同时代的椅子呈现日用品设计演变"
    }
  ]
}
