{
  "schemaVersion": "pracmo-public-action@v2",
  "clientRequestId": "public-action-49-parent-child-question-draw-20260819-v1",
  "catalog": {
    "category": "creative",
    "tags": [
      "亲子创作",
      "想象力",
      "共同绘画",
      "10分钟",
      "家庭陪伴"
    ],
    "coverImage": {
      "localPath": "assets/cover.jpg",
      "alt": "亲子两双手在桌面上画出同一个奇想问题的不同答案"
    }
  },
  "template": {
    "title": "亲子一问一画",
    "description": "提出一个没有标准答案的“如果……会怎样”，亲子各画一版，再互相说一句从对方作品里看到的新发现。上传两张作品或合照即完成；不比较画得像不像。",
    "iconCode": "design",
    "colorCode": "coral",
    "scheduleType": "weekly_quota",
    "scheduleConfigJson": "{\"quota\":3}",
    "timezone": "Asia/Shanghai",
    "deadlineLocalTime": "20:30",
    "gracePolicy": "none",
    "completionMode": "rich_media",
    "contentMode": "self_directed"
  },
  "assets": [
    {
      "assetId": "cover",
      "role": "cover",
      "localPath": "assets/cover.jpg",
      "alt": "亲子两双手在桌面上画出同一个奇想问题的不同答案"
    }
  ]
}
