{
  "schemaVersion": "pracmo-public-action@v2",
  "clientRequestId": "public-action-14-daily-reading-question-20260811-v1",
  "catalog": {
    "category": "reading",
    "tags": [
      "阅读理解",
      "每日一题",
      "短文",
      "单选题",
      "阅读训练"
    ],
    "coverImage": {
      "objectKey": "material/100004/action-assets/staging/cover/20260811T145650Z-f8d17340c1-cover.jpg",
      "url": "https://wancai-beijing.oss-cn-beijing.aliyuncs.com/material/100004/action-assets/staging/cover/20260811T145650Z-f8d17340c1-cover.jpg",
      "alt": "从短文线索推理出阅读理解答案"
    }
  },
  "template": {
    "title": "每日阅读理解一题",
    "description": "每天读一段原创短文，完成一道需要依据文本线索判断的单选题，并看懂每个选项背后的推理误区。",
    "iconCode": "book",
    "colorCode": "mint",
    "scheduleType": "daily",
    "scheduleConfigJson": "{}",
    "timezone": "Asia/Shanghai",
    "deadlineLocalTime": "20:00",
    "gracePolicy": "none",
    "completionMode": "one_tap",
    "contentMode": "puki_generated",
    "generatedContentConfig": {
      "schemaVersion": 1,
      "type": "quick_qa",
      "instruction": "结合甲程目标生成阅读理解单选题。每题先给180—300字原创中文短文，再提出一个必须依据文本线索判断的问题；轮换主旨、因果、指代、推断、结构作用和作者态度，并避开近期主题。提供4个长度相近、语法一致的选项，只有一个最佳答案；错误项分别体现断章取义、范围扩大、因果倒置或无依据推断等真实误区，不能靠常识明显排除。解释指出支持答案的具体线索，并简要说明其他选项错在哪里。短文不得依赖实时新闻，不复制受版权保护作品。输出前检查题干自包含、答案唯一、干扰项有辨析价值且批次内角度不重复。",
      "quickQa": {
        "questionType": "single_choice"
      }
    }
  },
  "assets": [
    {
      "assetId": "cover",
      "role": "cover",
      "alt": "从短文线索推理出阅读理解答案",
      "objectKey": "material/100004/action-assets/staging/cover/20260811T145650Z-f8d17340c1-cover.jpg",
      "url": "https://wancai-beijing.oss-cn-beijing.aliyuncs.com/material/100004/action-assets/staging/cover/20260811T145650Z-f8d17340c1-cover.jpg",
      "contentType": "image/jpeg",
      "sizeBytes": 147575,
      "sha256": "5472a039b0cac6e4b5d3c746c0f54641cddf4c92b9be9a29edce6811fa44b5ad"
    }
  ]
}
