{
  "schemaVersion": "pracmo-public-action@v2",
  "clientRequestId": "public-action-08-daily-classic-literature-20260811-v1",
  "catalog": {
    "category": "reading",
    "tags": [
      "名著",
      "文学",
      "经典阅读",
      "5分钟",
      "阅读积累"
    ],
    "coverImage": {
      "objectKey": "material/100004/action-assets/staging/cover/20260811T145636Z-f6e447e745-cover.jpg",
      "url": "https://wancai-beijing.oss-cn-beijing.aliyuncs.com/material/100004/action-assets/staging/cover/20260811T145636Z-f6e447e745-cover.jpg",
      "alt": "翻开的经典书页与人物叙事线索"
    }
  },
  "template": {
    "title": "每日名著微阅读",
    "description": "每天用五分钟观察一部经典作品中的人物选择、叙事细节或表达方法，在克制解读中积累深阅读视角。",
    "iconCode": "literature",
    "colorCode": "clay",
    "scheduleType": "daily",
    "scheduleConfigJson": "{}",
    "timezone": "Asia/Shanghai",
    "deadlineLocalTime": "20:30",
    "gracePolicy": "none",
    "completionMode": "one_tap",
    "contentMode": "puki_generated",
    "generatedContentConfig": {
      "schemaVersion": 1,
      "type": "reading",
      "instruction": "生成一期“每日名著微阅读”中文内容。优先结合甲程关注主题，从中外公版经典、神话、寓言或已进入公共领域的作品中选择一个片段、人物选择或叙事技巧，避开近期作品和角度。正文600—900字，依次包含：作品与情境简要介绍、一个值得观察的细节、该细节如何影响人物或叙事、与现代生活的一个克制连接、一个开放式观察问题。不得大段复刻原文；必要引用限一句短句且不得伪造。不要把个人解读写成唯一答案，不虚构作者生平或创作动机。标题体现本期观察点。输出前检查：没读过原作也能理解，同时能激发继续阅读兴趣。"
    }
  },
  "assets": [
    {
      "assetId": "cover",
      "role": "cover",
      "alt": "翻开的经典书页与人物叙事线索",
      "objectKey": "material/100004/action-assets/staging/cover/20260811T145636Z-f6e447e745-cover.jpg",
      "url": "https://wancai-beijing.oss-cn-beijing.aliyuncs.com/material/100004/action-assets/staging/cover/20260811T145636Z-f6e447e745-cover.jpg",
      "contentType": "image/jpeg",
      "sizeBytes": 164641,
      "sha256": "a1f5d88887959bf1f266575c050ab1177a0309c9b778af3171d7bcbef46e3185"
    }
  ]
}
