{
  "schemaVersion": "pracmo-public-action@v2",
  "clientRequestId": "public-action-42-meeting-rescue-response-20260812-v1",
  "catalog": {
    "category": "work",
    "tags": [
      "会议沟通",
      "临场反应",
      "职场场景",
      "沟通判断",
      "单选题"
    ],
    "coverImage": {
      "localPath": "assets/cover.jpg",
      "alt": "团队在会议卡点中通过三张便签重新聚焦下一步"
    }
  },
  "template": {
    "title": "会议救场怎么接",
    "description": "每天处理一个会议跑题、冷场、分歧或信息不足场景，选择一句兼顾目标、关系和信息完整性的临场回应。",
    "iconCode": "presentation",
    "colorCode": "blue",
    "scheduleType": "weekdays",
    "scheduleConfigJson": "{}",
    "timezone": "Asia/Shanghai",
    "deadlineLocalTime": "17:30",
    "gracePolicy": "none",
    "completionMode": "one_tap",
    "contentMode": "puki_generated",
    "generatedContentConfig": {
      "schemaVersion": 1,
      "type": "quick_qa",
      "instruction": "生成中文会议临场回应单选题，并结合甲程目标与当前状态调整复杂度。每题给出会议目标、用户角色、关系边界和当前卡点，轮换跑题、冷场、分歧升级、信息不足、时间将尽和责任模糊等情境。提供4句自然回应，唯一最佳项应在澄清事实、回扣目标、保护关系和推动下一步之间取得更好平衡；错误项体现暴力打断、含糊拖延、越权承诺或回避问题。解释比较关键取舍，并给一个可替换表达。不得假设用户有管理权，不生成羞辱、操控或歧视话术。输出前检查角色权限明确、答案唯一且选项都像真实会议语言。",
      "quickQa": {
        "questionType": "single_choice"
      }
    }
  },
  "assets": [
    {
      "assetId": "cover",
      "role": "cover",
      "localPath": "assets/cover.jpg",
      "alt": "团队在会议卡点中通过三张便签重新聚焦下一步"
    }
  ]
}
