{
  "schemaVersion": "pracmo-public-action@v2",
  "clientRequestId": "public-action-54-contact-old-friend-20260819-v1",
  "catalog": {
    "category": "mind",
    "tags": [
      "老友联系",
      "社会连接",
      "退休生活",
      "主动问候",
      "10分钟"
    ],
    "coverImage": {
      "objectKey": "material/100004/action-assets/staging/cover/20260819T065821Z-8d2e2e7939-cover.jpg",
      "url": "https://wancai-beijing.oss-cn-beijing.aliyuncs.com/material/100004/action-assets/staging/cover/20260819T065821Z-8d2e2e7939-cover.jpg",
      "alt": "一位精神饱满的长者在窗边给多年好友打电话"
    }
  },
  "template": {
    "title": "今天联系一个老朋友",
    "description": "给一位愿意联系的人打电话、发语音，或约定下一次见面，完成一次真实连接。不要求聊很久，也不强迫恢复曾经让人不舒服的关系。",
    "iconCode": "chat",
    "colorCode": "coral",
    "scheduleType": "weekly_quota",
    "scheduleConfigJson": "{\"quota\":3}",
    "timezone": "Asia/Shanghai",
    "deadlineLocalTime": "20:30",
    "gracePolicy": "none",
    "completionMode": "one_tap",
    "contentMode": "self_directed"
  },
  "assets": [
    {
      "assetId": "cover",
      "role": "cover",
      "alt": "一位精神饱满的长者在窗边给多年好友打电话",
      "objectKey": "material/100004/action-assets/staging/cover/20260819T065821Z-8d2e2e7939-cover.jpg",
      "url": "https://wancai-beijing.oss-cn-beijing.aliyuncs.com/material/100004/action-assets/staging/cover/20260819T065821Z-8d2e2e7939-cover.jpg",
      "contentType": "image/jpeg",
      "sizeBytes": 189542,
      "sha256": "c1dc00d7f4e8f2ffe3e9dcd20f337accd9a387e7d75a5c000f8318230d7f2745"
    }
  ]
}
